495085241384841216,2014-08-01 02:54:54 -0300,"RT @gabialmadan: Que mane manifestação o que, esse problema já vem de muito antes de manifestações de 2000...",,,Brazil,-1.0
495088996549427201,2014-08-01 03:09:49 -0300,Não é uma manifestação que vai fazer um viciado em droga parar de roubar os outros.,,,"",-1.0
495087243854643200,2014-08-01 03:02:51 -0300,"Nem vou em manifestação contra a violência, pois é a coisa mais inútil que tem.",,,"",-1.0
495087084387196928,2014-08-01 03:02:13 -0300,"Agora que eu descobri que aquele ""Ponta Porã de joelhos"" é uma manifestação e não um culto, ASHASHASHHASHASAS",,,"",-1.0
495129928397246464,2014-08-01 05:52:28 -0300,AI SIM CONCORDO EM TER MANIFESTAÇÃO @g1rio: Pedágio na Ponte Rio-Niterói e na Via Dutra ficam mais caros nesta sexta http://t.co/B50OXfpmeZ,,,"-22.777123,-43.402544",-1.0
495118042108796928,2014-08-01 05:05:14 -0300,deus ta de olho esses enxu na manifestação de hoje viu,-22.93984678,-47.13240528,❤ @_pqppedrozo ❤,-1.0
495109847202168832,2014-08-01 04:32:40 -0300,"O mundo sempre vai precisar da poesia; seja ela na musica, na literatura ou em qualquer outro tipo de manifestação artísticas existente.",,,"",-1.0
504630338153635841,2014-08-27 11:03:42 -0300,Quanto custa à democracia cada voto nesta aristocracia pactuada entre todos?.. o teu #VOTO é a maior manifestação de cobardia! #ACORDA,,,Porto - Portugal,-1.0
504629351577845761,2014-08-27 10:59:47 -0300,"Art. 5º, inciso IV: - é livre a manifestação do pensamento, sendo vedado o anonimato;",,,Brasil,-1.0
504628747786784768,2014-08-27 10:57:23 -0300,"@rstnoar Não adianta ficar fazendo manifestação.  VAI LÁ E DÁ UM GOLPE DE ESTADO, CACETE! Não tm coragem? Então VÃO TRABALHAR, VAGABUNDOS!!!",,,Estarei em todo lugar...,-1.0
504627554331144192,2014-08-27 10:52:39 -0300,E ai Vc acessa o twitter e só tem manifestação na cidade de SP. Que tristeza vive meu Brasil! http://t.co/y7LqkwRDjZ,46.2653922,-73.88315085,São Paulo,-1.0
504603153904705537,2014-08-27 09:15:41 -0300,RT @DaniloGentili: Se o Levy Fidelix ganhar a eleição convocarei uma manifestação pelo movimento passe livre de aerotrem.,,,"",-1.0
502572211614797824,2014-08-21 18:45:27 -0300,@lubrinas Bora! Ai depois fazemos uma manifestação por ai de boas reclamando que o governo é injusto e desigual com a sociedade o/// u.u,,,"",-1.0
502570609537482752,2014-08-21 18:39:05 -0300,RT @FlavioDino: A empresa que é de propriedade do meu adversario quer fazer um debate. So irei se houver garantias à minha manifestacao e à…,,,Maranhão,-1.0
504324655499718657,2014-08-26 14:49:02 -0300,"@littlekoalar bby, liguei nos correios, eles refizeram a manifestaçao pra receita federal, vamos ver agora, né :T",,,(￣ε(#￣)︴,-1.0
504293173146165248,2014-08-26 12:43:56 -0300,"RT @livraz: Próxima manifestação vou lá soltar uns rojões e batucar na porta da casa do Alckmin, quão rápido vocês acham que a PM aparece c…",,,"",-1.0
504289440249176064,2014-08-26 12:29:06 -0300,"Um tal de Rafael Vieira foi preso com coquetéis molotov, na manifestação por sua libertação tinha um cartaz:... http://t.co/04cVzISCNJ",,,"Brazil, Feira de Santana",-1.0
504058374926127105,2014-08-25 21:10:56 -0300,@pqdtjpa Agradecemos o contato. Sua manifestação foi direcionada a empresa. Receberá resposta através dos meios de contato.,,,Rio de Janeiro,-1.0
504055954682707968,2014-08-25 21:01:19 -0300,RT @RobertoLuiz7: A Venezuela sofre com o delinqüente Maduro Fogo atinge policial durante manifestação n Venezuela - notícias em Mundo http…,,,"",-1.0
504054360108978176,2014-08-25 20:54:59 -0300,RT @g1: Fogo atinge policial durante manifestação na Venezuela http://t.co/NW7FdkdU95 #G1 http://t.co/njmxVxzHmG,,,"",-1.0
504052773101776897,2014-08-25 20:48:40 -0300,"Se o Alckimin aprovar essa lei absurda das máscaras vou propor uma manifestação V de vingança style, alguém topa?",,,São Paulo,-1.0
504052703165968384,2014-08-25 20:48:23 -0300,"@orgasmodoasa ta valendo qualquer forma de manifestação, código morsa, balões, cartas, diários, letras de músicas, sinal de fumaça, tudo",,,orbit ,-1.0
503993683696295936,2014-08-25 16:53:52 -0300,Prefeitura de Sumaré garante pagamento do Proeb nesta 3ª-feira e creches particulares encerram manifestação parcial http://t.co/rRh7UgJ6B0,,,"",-1.0
503993287825690624,2014-08-25 16:52:18 -0300,Polícia usa bastões para dispersar manifestação contra Merkel na Galiza - JN http://t.co/TiXPjjpGUk,,,Portugal,-1.0
503986282213945344,2014-08-25 16:24:27 -0300,RT @fernandesjln: Até a vaia do samu foi mais animada que a manifestação de vitória do bope!,,,"",-1.0
503984555817443328,2014-08-25 16:17:36 -0300,RT @CatecismoJovem: Adoramos a Deus porque Ele existe e porque o respeito e a adoração são a resposta apropriada à Sua manifestação e à Sua…,,,"",-1.0
503974063669526528,2014-08-25 15:35:54 -0300,@AecioNeves O Rio de janeiro aguarda uma manifestação a cerca dos royalties do petróleo. Até o momento o tema foi pouco debatido.,,,"",-1.0
503959861819109377,2014-08-25 14:39:28 -0300,Porra de Manifestação,,,São Luis,-1.0
503955696707440640,2014-08-25 14:22:55 -0300,"RT @_davidjosh_: Queremos replay, partiu manifestação",,,"",-1.0
503953503296167937,2014-08-25 14:14:12 -0300,@MauroCezarESPN viu matéria da @trivela sobre festa da torcida do Palace no último jogo? Manifestação parecida com as hinchas Sul-americanas,-22.93561804,-43.17554203,Brasil,-1.0
503953059559788544,2014-08-25 14:12:27 -0300,RT @evilravenna: manifestação de indies revoltados no twitter pois lorde é mais rock que arctic monkeys,,,Rio Branco - Acre / Brasil,-1.0
498879185998606336,2014-08-11 14:10:41 -0300,Vai ser um grande momento de manifestação do Amor de Deus.  Motive o seu Grupo de Oração. http://t.co/UUO7yzOjNP,,,Florianopolis -SC,-1.0
498888819106525185,2014-08-11 14:48:58 -0300,"ESTÁ AQUI O VÍDEO DA MANIFESTAÇÃO PACIFICA NA PRAÇA DA MATRIZ EM TATUÍ CONTRA O AUMENTO DO IPTU, O POVO XINGANDO... http://t.co/6fKRyix2io",,,TATUI SP,-1.0
498889575667101696,2014-08-11 14:51:58 -0300,"""difundir as raízes sertanejas enquanto manifestação cultural e artística a partir da música romântica...""",,,São Caetano do Sul/SP,-1.0
498890105026007040,2014-08-11 14:54:04 -0300,"RT @RNSustentavel: Termina hoje(11), às 23h59 o prazo para Manifestação de Interesse nos Editais 001, 002 e 003. Inscrições no site http://…",,,"",-1.0
498896363233755136,2014-08-11 15:18:56 -0300,e tem gente lá se doendo que tá tendo manifestação e tão quebrando vitrine de loja mas esqueceram que 1 garoto inocente foi morto.,,,"Sp,Brasil.",-1.0
498897453924372481,2014-08-11 15:23:16 -0300,Gostei de um vídeo @YouTube de @jliopiva http://t.co/WLclRmDxWN MANIFESTAÇÃO PACIFICA NA PRAÇA DA MATRIZ EM TATUÍ - SP CONTRA O,,,TATUI SP,-1.0
498909554374365185,2014-08-11 16:11:21 -0300,"RT @BispoMacedo: Por causa da manifestação da fé, Deus faz o impossível.",,,"",-1.0
498909375395028992,2014-08-11 16:10:39 -0300,@afonso3d averiguações e providências. Receberá resposta à sua manifestação através dos meios solicitados.,,,Rio de Janeiro,-1.0
498915896534917120,2014-08-11 16:36:33 -0300,Flamengo é pego de surpresa e espera manifestação do jogador http://t.co/9C9hLxj9wJ || #GloboEsporte,,,"",-1.0
498918512732413952,2014-08-11 16:46:57 -0300,"Hoje meu dia está sendo muito corrido, gravação de vídeo, reunião, passada na manifestação das ocupações e agora aula.",,,Belo Horizonte,-1.0
498918528414543873,2014-08-11 16:47:01 -0300,Adorei a manifestação das nossas meninas @scheilacarvalhooficial! kkkkk Obrigada a @sheilamelloqueen pela gostosa... http://t.co/pF1n1Wy5xP,,,São Paulo | Brazil,-1.0
498919800043610112,2014-08-11 16:52:04 -0300,RT @caapiaui: Ponto facultativo adia manifestação dos advogados piauienses - http://t.co/4XnAl7PC43 http://t.co/c3iUkLTHdE,,,"ÜT: -5.065683,-42.794682",-1.0
498920248691924993,2014-08-11 16:53:51 -0300,"Caso Luiz Antonio: pego de surpresa, Fla espera manifestação do jogador http://t.co/UcXGBESqML",,,Flamengo,-1.0
498922426697531392,2014-08-11 17:02:30 -0300,RT @Guerreiro_FFC: Parceria entre Fla e fornecedora prevê rescisão ou multa por vexames http://t.co/8LGlAgx2Dr … http://t.co/Kqwv9ckCU5 …,,,RJ,-1.0
498928218007937025,2014-08-11 17:25:31 -0300,"Orgulho feminino nesses tempos de manifestação política de gênero, quando mulheres vão à ruas mostrando peitos,... http://t.co/6Vqu6v2TfW",,,Brasil,-1.0
498929181011369984,2014-08-11 17:29:21 -0300,"Depoimento sem dano, CFESS divulga nova Manifestação Jurídica com o posicionamento da entidade sobre a suspensão... http://t.co/dx1kCl2b1G",,,Salvador,-1.0
498930656437886976,2014-08-11 17:35:12 -0300,@juliococielo Julio se vc n fase video novo vai junta eu eos mlk aqui da vila vai fase uma manifestaçao na sua casa,,,"",-1.0
498942785635246080,2014-08-11 18:23:24 -0300,"Entre os objetivos do projeto estão: ""difundir as raízes sertanejas enquanto manifestação cultural e artística a... http://t.co/12JSo55hKD",,,São Manuel,-1.0
498944624724307968,2014-08-11 18:30:43 -0300,"""Vou ser o governador q vai lutar com vocês para q o estado de SP seja livre de qualquer manifestação homofóbica ou racista"", @padilhando",,,São Paulo - Brazil,-1.0
498945157669343232,2014-08-11 18:32:50 -0300,"RT @MudaMais: ""Pra q esse estado seja livre de qlq manifestação homofóbica e racista"" @padilhando  \o/ #EstudantesComDilma",,,Osasco,-1.0
498945467167035392,2014-08-11 18:34:03 -0300,"Caso Luiz Antonio: pego de surpresa, Fla espera manifestação do jogador. http://t.co/ywjlAPGL33",,,Brasil,-1.0
498945687309254656,2014-08-11 18:34:56 -0300,"Hoje a manifestação vai ser pacifica, igual a ação da policia na periferia..",,,"",-1.0
498945622431789057,2014-08-11 18:34:41 -0300,"RT @FolhaPolitica: Black Bloc preso em manifestação diz que participou das FARC, assume ser comunista, defende Stálin e diz que vai... http…",,,BRAZIL,-1.0
498949406537043968,2014-08-11 18:49:43 -0300,"comentarei atrasado pra variar,prevejo minha manifestação de ódio pela Gery",,,"Shipper,17",-1.0
499507165984731136,2014-08-13 07:46:03 -0300,Eu acho que esse povo deveria arrumar um emprego em vez de ficar atrapalhando trânsito e as pessoas que estão indo trabalhar #Manifestação,,,Belo Horizonte,-1.0
499510026294534144,2014-08-13 07:57:25 -0300,AHAHAHAHA http://t.co/0ohzti32Ly TOMARA Q VC CONSIGA IR P RUSSIA AMIGUINHO E N VOLTE MAIS ESTAMOS TORCENDO POR VC,,,/dev/null,-1.0
499510193726967808,2014-08-13 07:58:05 -0300,"Da Presidente a chefe de quadra, falar errado para o PT é questão de semântica ou seria manifestação fônica do signo linguístico? Idiotice?",,,Brazil,-1.0
499579110864470016,2014-08-13 12:31:56 -0300,"O garoto da CDD tá sendo operado. Ainda não tem manifestação por lá, parece q vai ser mais pra noite...",,,Rio de Janeiro,-1.0
499578692574904320,2014-08-13 12:30:16 -0300,@Marta01Rocha Sua manifestação foi direcionada a empresa. Receberá resposta através dos meios de contato. Estamos à disposição.,,,Rio de Janeiro,-1.0
501911862192406529,2014-08-19 23:01:27 -0300,"Vai em manifestação pra tirar foto, não assiste debate do próx. governador pq não quer. Gente assim não merece ter o direito de votar.",,,Rio de Janeiro,-1.0
501911249442340865,2014-08-19 22:59:01 -0300,Eu não ouvi manifestação de plateia...,,,Duque de Caxias,-1.0
501911069083058178,2014-08-19 22:58:18 -0300,Pezao diz que avancou com direitos sociais...... e o direito à manifestacao?,,,"Rio de Janeiro - RJ, Brazil",-1.0
501910918012600320,2014-08-19 22:57:42 -0300,RT @BehtShalom: A minha cama espera ansiosamente pela manifestação do meu sono,,,"São luis/MA, Brazil",-1.0
501910228984922112,2014-08-19 22:54:58 -0300,RT @BlogOlhoNaMira: Venezuela é aqui: dupla de corajosos impedindo manifestação pacífica  http://t.co/NOHzwNZGst,,,fone 81 85073545,-1.0
501909605761708032,2014-08-19 22:52:29 -0300,A minha cama espera ansiosamente pela manifestação do meu sono,,,Ceará,-1.0
502036054661419008,2014-08-20 07:14:57 -0300,a imprensa dizendo que os alunos PROCURAM A REPRESSÃO PULICIAL CARA ELES VIVEM DISSO DAS MANIFESTAÇÃO ISSO É UM DESPERDÍCIO DE DINHEIRO PUBL,,,São Paulo,-1.0
502037584118558721,2014-08-20 07:21:02 -0300,O povo perde o direito de se manifestar pq a polícia maltrata e massacra qualquer atitude #usp #manifestação #acordabrasil,,,"",-1.0
502141461044154369,2014-08-20 14:13:48 -0300,@GPFBCBC  Sua manifestação foi direcionada a empresa,,,Rio de Janeiro,-1.0
502207213822554112,2014-08-20 18:35:04 -0300,Túnel do tempo | O povo de Belém toma para si a alegre missão de resgatar a cultura como manifestação de massa. A... http://t.co/7Vh0qop3R9,,,"Belém, Pará, Brasil",-1.0
502207301139562496,2014-08-20 18:35:25 -0300,RT @DaspTheBest: Vou fazer uma manifestação para que o fio do carregador tenha no minimo 2 metros,,,"",-1.0
502208063718567936,2014-08-20 18:38:27 -0300,Flores! A Natureza em sua mais bela manifestação!,,,Feira de Santana - Ba,-1.0
502241678720524288,2014-08-20 20:52:02 -0300,Que linda essa manifestação... Ainda bem que já passou.,,, Tarada ™  ۞,-1.0
502245938262704128,2014-08-20 21:08:57 -0300,Extra terrestres são as  5.000.000.000.000. de oportunidades que o Universo oferece de manifestação da vida. http://t.co/sAOIdIxqCO,,,Piracicaba (Brasil),-1.0
502250531503734787,2014-08-20 21:27:12 -0300,"Bateu uma saudade de quando fizeram o gigante acordar, e todo dia tinha manifestação, protesto, #Vemprarua e etc...",,,Brasília ,-1.0
502251021461372929,2014-08-20 21:29:09 -0300,"RT @fmei7777: Dias 20 e 21 de setembro haverá uma gigante manifestação pelo clima.
http://t.co/tAzots1OGh",,,Brasil,-1.0
502251333484019713,2014-08-20 21:30:23 -0300,"RT @larryproofsBRA: [ Larry Shippers fizeram uma ""manifestação"" na foto do Harry. ]

Logo depois ele twittou ""Amo todo mundo"". http://t.co/…",,,"",-1.0
502256884913815552,2014-08-20 21:52:27 -0300,"A manifestação que era pra ser contra a violência, deixa mais feridos como consequência...",-22.8201401,-43.1812776,"",-1.0
502263943176650753,2014-08-20 22:20:30 -0300,acho que as manifestação no ct surgiram efeito,,,Curitiba - PR,-1.0
502263962063626240,2014-08-20 22:20:34 -0300,"RT @caiomartinshen: A universidade número 1 do Brasil, vive em manifestação.  Belo exemplo de controle e inteligência USP.",,,"",-1.0
502264191504629760,2014-08-20 22:21:29 -0300,"RT @luciabortolazzo: @biacall8 @RedeGlobo @portaldaband  E pior salário, não adianta fazer manifestação pq o governador, manda polícia desc…",,,"",-1.0
502264804720250880,2014-08-20 22:23:55 -0300,Concordo com a manifestação da galera até aqui. Hudson muito bem no jogo. E o Denilson também. Ambos atrapalhando a vida do Dalessandro.,,,São Paulo,-1.0
502264974845435904,2014-08-20 22:24:36 -0300,Concordo com a manifestação da galera até aqui. Hudson muito bem no jogo. E o Denilson também. Ambos atrapalhando a vida do Dalessandro.,,,"",-1.0
502267167275245568,2014-08-20 22:33:19 -0300,RT @amissaonordeste: Amanhã estaremos conhecendo mais um povoado (no Ceará) que está necessitado da manifestação da Igreja. Orem para que D…,,,"",-1.0
502267799491059714,2014-08-20 22:35:49 -0300,"Aquele Momento Que Vs Quer Andar Mais Rápido Mais Tem Uma Manifestação De Gente Na Sua Frente! 
Pior Que Zumbi!
Kkk'",,,"",-1.0
502269706200702976,2014-08-20 22:43:24 -0300,"Uma vez confirmado o diagnóstico de esclerose múltipla, uma doença inflamatória desmielizante, com manifestação remitente-recorrente,",,,Brasil,-1.0
502270307735175168,2014-08-20 22:45:47 -0300,Para mim é modinha manifestação passiva.  Essa tem que causar impacto,,,"",-1.0
502270137979117569,2014-08-20 22:45:07 -0300,"Mas a realidade mesmo e q vcs tao postando coisa do iPhone de vcs, embaixo da saia tem aquele nike e é paz mas ta apoiando manifestação",,,sp,-1.0
502277586404139008,2014-08-20 23:14:43 -0300,"@larimdlr é um ato falho, pode ser uma manifestação reprimida no seu inconsciente.",,,Dourados-MS,-1.0
502279120336998400,2014-08-20 23:20:48 -0300,"@JustFocles @danibenser a luta contra o preconceito, ela é diária, moço. E começa não achando graça neste tipo de manifestação. :)",,,Brasil ,-1.0
502279780369465344,2014-08-20 23:23:26 -0300,RT @amissaonordeste: Amanhã estaremos conhecendo mais um povoado (no Ceará) que está necessitado da manifestação da Igreja. Orem para que D…,,,cabo frio-RJ,-1.0
502281443809447937,2014-08-20 23:30:02 -0300,A ocasião faz a manifestação,,,São Paulo,-1.0
502282849656262656,2014-08-20 23:35:37 -0300,Kkkk manifestação,,,"",-1.0
502284134014672898,2014-08-20 23:40:44 -0300,Gostei de um vídeo @YouTube http://t.co/B5pmirII2t Olímpio Faz Manifestação Contra a farsa do governador Alckmin,,,MIRANDÓPOLIS-SP,-1.0
502285524183556096,2014-08-20 23:46:15 -0300,"Geralmente eu fico decepcionada com remakes, se inventarem remake de hp e eu ainda estiver viva, farei manifestação contra.",,,Santo andré - SP,-1.0
502290902938038272,2014-08-21 00:07:38 -0300,Não pode ter uma manifestação de sentimento aqui que já é depressão,,,Brazil,-1.0
502295963705544704,2014-08-21 00:27:44 -0300,"RT @dafnesampaio: não basta destruir a USP, tem que também bater e dar tiro em grevistas http://t.co/eDyVeeEr5F parabéns @geraldoalckmin_",,,"",-1.0
502296676112297984,2014-08-21 00:30:34 -0300,sentindo a manifestação de ácido lático nas minhas pernas,,,"",-1.0
502297246260822017,2014-08-21 00:32:50 -0300,Eu deveria ter ficado dormindo hj 😴 só perdi meu tempo vendo a manifestação jsbsjshdhdjdjd porque né,,,"",-1.0
502297655331291136,2014-08-21 00:34:27 -0300,RT @domingasdelsant: @rekaran3 quem não aparece mais? Necessitamos uma manifestação em BSB,,,"",-1.0
502302374124613633,2014-08-21 00:53:12 -0300,"Não nascemos, nem morremos. Como toda energia, nós simplesmente mudamos de forma, de tamanho e de manifestação.... http://t.co/rIUNPSAcYR",,,"Osasco, São Paulo - Brasil ",-1.0
502319004279926786,2014-08-21 01:59:17 -0300,"gata, vc n é manifestação mas fez o meu gigante acordar""",,,Arraial do cabo,-1.0
502331207460585472,2014-08-21 02:47:47 -0300,"@luizflavioassis @biacall8 Somos as máquinas. Uma manifestação popular com 10, 15 mil contra o PIG nas ruas, não seria eficaz e oportuno?",,,"",-1.0
502333405481426946,2014-08-21 02:56:31 -0300,@biacall8 Bia.Não é possível que não tenha entendido ainda que me refiro a uma manifestação popular nossa contra o PIG nas ruas.Se não dá...,,,"",-1.0
502345498708410368,2014-08-21 03:44:34 -0300,#Mundo: Polícia prende mais de 40 pessoas em manifestação em Ferguson http://t.co/kBNaonvNMq,,,"Maceió, Alagoas",-1.0
502357298720026624,2014-08-21 04:31:28 -0300,"Até o procurador-geral da República, Roberto Gurgel, considera ""extremamente relevante"" manifestação da Comissão de Ética da Pres sobre Lupi",,,São Chico,-1.0
502369996132327424,2014-08-21 05:21:55 -0300,"Já alguma vez se viu neste pais uma manifestação, ou greve dos políticos?",,,Portugal,-1.0
502387860037967872,2014-08-21 06:32:54 -0300,Iam fazer uma manifestação anti-racismo e queriam forçar a entrada num espaço semi-público? #Portugalistão,,,"Porto, Portugal",-1.0
502392839410814976,2014-08-21 06:52:41 -0300,"Gritos de manifestação aqui na Sabara ??
OMG",-23.6730166,-46.6863368,"São Paulo, SP",-1.0
502397394613719040,2014-08-21 07:10:47 -0300,@mrcaio Haha até agora não teve manifestação de ninguém que não se importa.,,,Brasil,-1.0
502397531931049984,2014-08-21 07:11:20 -0300,Bah 7 horas da manha e o povo fazendo manifestação...,,,Rio Grande do Sul,-1.0
502899970702581760,2014-08-22 16:27:51 -0300,vai ter manifestação larry nos comentários do video do louis? eh isso mesmo gkjkhfjkdjk,,,Brazil ,-1.0
502900107139104768,2014-08-22 16:28:23 -0300,ESTOU COMPARTILHANDO NÃO POR MANIFESTAÇÃO EM DEFESA DE POLITICA E SIM PQ A RESPOSTA DESSA MULHER É DIGNA DE APLAUSOS! http://t.co/KGUetSGy1C,,,Recife,-1.0
502900267067531264,2014-08-22 16:29:01 -0300,@bethcastilho vamos ver como será conduzido este caso. Precisamos saber inclusive se foi feito BO mesmo. Mas parece q terá manifestação,,,são paulo/br,-1.0
502900610870837248,2014-08-22 16:30:23 -0300,@dayaarthur @tevivodolerelei VAMO TODO MUNDO FAZER MANIFESTAÇÃO PRO SHOW DE PÉ!!!!! haha Chama a @desireesaibert que quero ver alguém sentar,,,"",-1.0
502902896883929088,2014-08-22 16:39:28 -0300,"Ninguém merece manifestação, trasando o bglho todo ..",-22.8776834,-43.251349,"",-1.0
502903555737399297,2014-08-22 16:42:05 -0300,"Segundo SindServSV, professores realizarão passeata e manifestação.
Prefeitura afirma que está disponível para conversar com categoria.",,,"",-1.0
502909417042767872,2014-08-22 17:05:23 -0300,"RT @gu_afonso: Não precisa de manifestação contra imprensa não.. ""Jornal Nacional: 82 minutos negativos para Dilma e só 4 positivos"" http:/…",,,"",-1.0
502910700663369728,2014-08-22 17:10:29 -0300,"""Há quem veja nisto mais uma manifestação de radicalismo, fundamentalismo e outros desmandos do Tribunal... http://t.co/egyG8HZzLy",,,viseu,-1.0
502912052974067713,2014-08-22 17:15:51 -0300,RT @pistolinhaas: bora criar uma manifestação contra o pessoal do facebook que vem para o twitter??,,,longe mas sempre perto,-1.0
502912469317464064,2014-08-22 17:17:31 -0300,"A cada cidade, um novo apoio,a cada passo, uma manifestação de força nesta caminhada! Prof.Valfrido Arauá,tá conosco! http://t.co/vG2FRQWzUR",,,"Sergipe, Brasil",-1.0
502913638500679680,2014-08-22 17:22:09 -0300,n vou participar dessa manifestação no ig do louis,,,Brazil ,-1.0
502915564508282880,2014-08-22 17:29:48 -0300,"Tomaram que tenha ""manifestação"" kkkkkkkk!!!!",,,Grajaú ,-1.0
502936925775216641,2014-08-22 18:54:41 -0300,Obra aborda os fundamentos jurídicos e a regulamentação do Procedimento de Manifestação de Interesse: http://t.co/1O6bdxeXtK,,,São Paulo,-1.0
502938041967976448,2014-08-22 18:59:08 -0300,Se lembram disso? Rede de Marina coleta assinaturas em passeata anti-gay e em defesa da “família e bons costumes”.  http://t.co/PRYbk5k5hP …,,,Rio de Janeiro,-1.0
502938798968537089,2014-08-22 19:02:08 -0300,"""A cada um é dada a manifestação do Espírito, em vista do bem de todos.""  http://t.co/aDTk4AWD0r http://t.co/4SWSnD15nt",,,"Cuiabá, Mato Grosso",-1.0
502938960356990978,2014-08-22 19:02:47 -0300,RT @Marcia_Borbo: Se lembram disso? Rede de Marina coleta assinaturas em passeata anti-gay e em defesa da “família e bons costumes”.  http:…,,,Porto Alegre,-1.0
502938950340984836,2014-08-22 19:02:44 -0300,Foi a primeira vez que vi uma manifestação,,,"",-1.0
502938929595957248,2014-08-22 19:02:39 -0300,"RT @padre_paulo: ""A cada um é dada a manifestação do Espírito, em vista do bem de todos.""  http://t.co/aDTk4AWD0r http://t.co/4SWSnD15nt",,,Cachoeira Paulista - SP,-1.0
498944624724307968,2014-08-11 18:30:43 -0300,"""Vou ser o governador q vai lutar com vocês para q o estado de SP seja livre de qualquer manifestação homofóbica ou racista"", @padilhando",,,São Paulo - Brazil,-1.0
498944616268562435,2014-08-11 18:30:41 -0300,"""Pra q esse estado seja livre de qlq manifestação homofóbica e racista"" @padilhando  \o/ #EstudantesComDilma",,,"",-1.0
498944419979329536,2014-08-11 18:29:54 -0300,Nem para milícia fazer pressão para arbitragem inventar uns pênaltis marotos... http://t.co/AWZJcIvwB8,,,"Natal, RN | Brasil ",-1.0
498942322961571840,2014-08-11 18:21:34 -0300,@jeanncarlo_ tava tendo manifestação,,,"",-1.0
498942134720790528,2014-08-11 18:20:49 -0300,"Por causa da manifestação da fé, Deus faz o impossível.",,,"",-1.0
498941779061006337,2014-08-11 18:19:24 -0300,A juventude quer liberdade de manifestação... Vamos ousar... Vamos inovar? #JuventudecomDilma,,,Brasil,-1.0
496750486645911553,2014-08-05 17:11:59 -0300,"Se sobrepomos dados de raça/cor e sexo, vemos como há a manifestação clara do machismo e do racismo em nossa sociedade #Seppir",,,Brasília,-1.0
496607988875276288,2014-08-05 07:45:45 -0300,"Foi uma grande manifestação de apoio a um jovem candidato a Deputado Estadual,
Firmino Paulo 45145. http://t.co/yEyrwFx7GA",,,BRASIL,-1.0
506235316676861952,2014-08-31 21:21:19 -0300,"Forte manifestação de Fábio Koff sobre o racismo: ""um problema que transcende a direção do Grêmio, já atingiu a esfera cultural e policial"".",,,Porto Alegre | RS,-1.0
506232670121365504,2014-08-31 21:10:48 -0300,@iuryguercio manifestação menos,,,"",-1.0
506232681735393280,2014-08-31 21:10:51 -0300,"@Fc_LuginGamer se ele tiver namorando eu mato a mina q estiver namorando, crio uma greve, uma manifestação",,,Alguma Bosta,-1.0
506227117244170240,2014-08-31 20:48:44 -0300,Felipão pede um basta ao racismo e diz que manifestação racista no estádio é uma bobagem e considera atos absurdos.,,,Porto Alegre,-1.0
506114328089870336,2014-08-31 13:20:33 -0300,"E isso deve partir de sua própria torcida. Viu manifestação racista no estádio? Filma, chama a polícia, FAÇA ALGUMA COISA!!,",,,Porto Alegre,-1.0
505724191665295360,2014-08-30 11:30:17 -0300,RT @V4sc0_: devíamos fazer grande manifestação para a escola não começar,,,"",-1.0
505602966481797120,2014-08-30 03:28:35 -0300,"Vivemos um tempo grandioso no quesito ""espaço de manifestação do pensamento"". Diante dessa grandiosidade, venho... http://t.co/kKwhoGJ3C1",,,Rio Branco - Acre,-1.0
505539874221350912,2014-08-29 23:17:53 -0300,"- O Black Metal é uma manifestação artística bem complexa, não somente por conta de suas letras nem de sua... http://t.co/Onj9LAM15B",,,São Paulo - SP,-1.0
505536079278395392,2014-08-29 23:02:48 -0300,"Eu peço isso há mais de 3 anos. Quem me conhece daqui, sabe os Por quês!!! Manifestação Popular contra mídia Suja! Quem lembra?",,,"",-1.0
