505533086038126592,2014-08-29 22:50:54 -0300,"Putz, o meu direito de livre manifestação política foi duramente criticado por um ""amigo"" aqui do Face. Outro dia... http://t.co/seknstgNNK",,,"Santos,SP",-1.0
505524313383268352,2014-08-29 22:16:03 -0300,"Já não basta ser roubado até as cueca pelos políticos, ainda ter q ler manifestação politica no twitter é o ó né, vão se foder todos",,,"",-1.0
505515788997238784,2014-08-29 21:42:10 -0300,Ficar bêbado e começar a falar em outra língua... Manifestação da inteligência ou encosto?,,,São Paulo
505515221603975168,2014-08-29 21:39:55 -0300,@itsmydirections Preciso de aliados para manifestação :(,,,"",-1.0
505431733609955328,2014-08-29 16:08:10 -0300,Nada mais típico que uma manifestação do complexo de Freud Flinstone! http://t.co/aX4daEZZGi,,,"Betim, Minas Gerais",-1.0
505158624692666368,2014-08-28 22:02:56 -0300,RT @SNewsGremio: Manifestação racista contra o Aranha. Lamentável...,,,"",-1.0
505137180734652416,2014-08-28 20:37:43 -0300,RT @RosisoRoberta: Clubes e ligas exigem eleição na FPF e acusam interventores de golpistas: Documento de manifestação foi assinado http:/…,,,"",-1.0
504087327589675008,2014-08-25 23:05:59 -0300,Fogo atinge policial durante manifestação na Venezuela http://t.co/U03Je4Xv8u,,,alvorada,-1.0
504073590493687809,2014-08-25 22:11:23 -0300,@lukaschimba é assim q tu me trata depois da minha manifestação de carinho ok,,,poa,-1.0
504073453184757761,2014-08-25 22:10:51 -0300,"Mas na minha opinião tem dois lados realmente as pessoas só olham pro problema qnd rola uma manifestação grande, então não foi de todo ruim",,,"",-1.0
498128077197959169,2014-08-09 12:26:03 -0300,"Eu ia fazer um belo cartaz hoje para manifestação, mas a preguiça foi maior do que qualquer revolução",,,"São Paulo, Brasil",-1.0
498126875412414464,2014-08-09 12:21:16 -0300,"Inciso 4º, do artigo 5º, da Constituição Federal: “É livre a manifestação do pensamento, sendo vedado o anonimato”.",,,Brasil,-1.0
498126323358117890,2014-08-09 12:19:04 -0300,"Manifestação de verdade é em dia de expediente, na praça principal da cidade, com REVOLTA e GRITOS! O resto é PERFUMARIA!",,,LUIZ HENRIQUE PARAHYBA,-1.0
497886307767840768,2014-08-08 20:25:20 -0300,"RT @prbispo7: Após 50 dias orando e Jejuando podemos sentir a manifestação do Espírito Santo. #Pentecostes10Mil @pastorotimar http://t.co…",,,"",-1.0
497886245956354048,2014-08-08 20:25:05 -0300,"@joaolimajr @Teledramaturgia nossa!!! Ia ter até manifestação na rua!!! As pessoas estão ficando muito chatas, né?",,,São Paulo/ BR,-1.0
498138044021891072,2014-08-09 13:05:39 -0300,"Photo: Minha única manifestação política, não postarei mais nada, a não ser que me encham o saco 😉... http://t.co/22Mfw1YI0B",,,Araras - Sp,-1.0
499943784499929088,2014-08-14 12:41:01 -0300,"RT @Marcelo_Astuto: Garoto é atingido em escola na CDD, kd a manifestação da população local? Se fosse a @PMERJ estaria um Caos na CDD!",,,Rio de Janeiro,-1.0
499944839589294080,2014-08-14 12:45:12 -0300,"Paquistão: oposição inicia marcha pela saída do premiê: A manifestação maior desafio ao governo de Sharif, ape... http://t.co/k83Pge5Kub",,,Brazil,-1.0
499953947709550592,2014-08-14 13:21:24 -0300,"@ParisFilmes O dia 19 chegou para lacrar qualquer manifestação inimiga neh? Hahaha http://t.co/5BFd39BNH3",,,"Teresina,Brasil ",-1.0
500482181865947137,2014-08-16 00:20:25 -0300,Nariz mais congestionado do que a Av. Paulista quando tem manifestação,,,"",-1.0
497775386592563200,2014-08-08 13:04:35 -0300,"Idiotas úteis seguindo a cartilha da mídia esquerda caviar fazem manifestação em supermercado francês, vão lá... http://t.co/7El3jAvUPt",,,"",-1.0
497688336853897216,2014-08-08 07:18:40 -0300,Se eu não receber hj vai piar manifestação,,,"",-1.0
500481097202155520,2014-08-16 00:16:06 -0300,Cês acreditam que minha vizinha saiu dizendo que ia p uma manifestação e era essa festa do estudante? Manifestação de álcool pode até ser...,,,São Luís,-1.0
497787354292432896,2014-08-08 13:52:08 -0300,melhor trilha sonora pro expediente: os gritos dos sem-teto fazendo manifestação na rua,,,São Paulo,-1.0
497503978650079232,2014-08-07 19:06:06 -0300,"Ela trás as palavras de aflição que ninguém ouve aquele grito de raiva na manifestação do povo",,,"",-1.0
497500319253688320,2014-08-07 18:51:33 -0300,Anúncios que não dão pra pular: Manifestação do Demônio.,,,São paulo - Capital.,-1.0
504126427152007168,2014-08-26 01:41:21 -0300,"Foi muito lindo, pelo menos para as mamães e papais corujas. Centro recebe manifestação pelo folclore http://t.co/Ctjav3LTVb",,,"Imbituba, SC",-1.0
504124300757336064,2014-08-26 01:32:54 -0300,Manifestação de carapanans nesse quarto,,,Skype: Samsfigueiredo,-1.0
504127985470164992,2014-08-26 01:47:32 -0300,"Migalhas Quentes - PL torna obrigatória manifestação do juiz sobre medidas cautelares antes de decretar a prisão http://t.co/yZelXuGkX4",-10.9285789,-37.0701586,Aracaju - SE,-1.0